{
  "schema_version": "openadapt.production-evidence-verification-policy/v1",
  "repository": "OpenAdaptAI/.github",
  "repository_id": "858454062",
  "repository_owner_id": "132681217",
  "reference_schema_version": "openadapt.production-evidence-object-reference/v2",
  "transport": "exact-commit-raw-github",
  "signer_registry_schema_version": "openadapt.qualification-signer-registry/v2",
  "embedded_signatures": [
    {
      "kind": "qualification-authority-state-receipt",
      "algorithm": "ed25519",
      "profile": "ed25519-canonical-signing-statement",
      "statement_schema_version": "openadapt.qualification-evidence-signing-statement/v1",
      "signature_domain": "OpenAdapt qualification authority state receipt v2\u0000",
      "projection": "canonical-object-minus-signature-and-signing-statement",
      "encoding": "base64-rfc4648-padded",
      "key_source": "active-qualification-signer-registry-v2"
    },
    {
      "kind": "qualification-evidence-decision-receipt",
      "algorithm": "ed25519",
      "profile": "ed25519-canonical-signing-statement",
      "statement_schema_version": "openadapt.qualification-evidence-signing-statement/v1",
      "signature_domain": "OpenAdapt qualification evidence decision receipt v1\u0000",
      "projection": "canonical-object-minus-signature-and-signing-statement",
      "encoding": "base64-rfc4648-padded",
      "key_source": "active-qualification-signer-registry-v2"
    },
    {
      "kind": "qualification-revocation-state-receipt",
      "algorithm": "ed25519",
      "profile": "ed25519-canonical-signing-statement",
      "statement_schema_version": "openadapt.qualification-evidence-signing-statement/v1",
      "signature_domain": "OpenAdapt qualification revocation state receipt v1\u0000",
      "projection": "canonical-object-minus-signature-and-signing-statement",
      "encoding": "base64-rfc4648-padded",
      "key_source": "active-qualification-signer-registry-v2"
    }
  ],
  "message_signature": {
    "profile": "sigstore-message-signature",
    "tool": "cosign",
    "version": "3.1.3",
    "runner": "ubuntu-24.04",
    "architecture": "linux-amd64",
    "installer_action": "sigstore/cosign-installer@6f9f17788090df1f26f669e9d70d6ae9567deba6",
    "url": "https://github.com/sigstore/cosign/releases/download/v3.1.3/cosign-linux-amd64",
    "sha256": "sha256:4629c757b7618056f8ddd7e2625ae9fdd94c0372a65049520bc7d9df9efc7f71",
    "size_bytes": 141178250,
    "trusted_root": {
      "repository": "sigstore/root-signing",
      "commit": "c6f23ff62645fb0c46ebc7945675835b52f91aa8",
      "path": "targets/trusted_root.json",
      "sha256": "sha256:6494e21ea73fa7ee769f85f57d5a3e6a08725eae1e38c755fc3517c9e6bc0b66",
      "size_bytes": 6787
    },
    "signing_config": {
      "repository": "sigstore/root-signing",
      "commit": "c6f23ff62645fb0c46ebc7945675835b52f91aa8",
      "path": "targets/signing_config.json",
      "sha256": "sha256:d358c75d032833f4193500f5b01b5760409410558fac962c599439adbb268b0f",
      "size_bytes": 219
    }
  },
  "sigstore": {
    "tool": "gh",
    "version": "2.98.0",
    "cert_oidc_issuer": "https://token.actions.githubusercontent.com",
    "deny_self_hosted_runners": true,
    "allow_public_good": false,
    "archives": [
      {"os":"linux","arch":"amd64","url":"https://github.com/cli/cli/releases/download/v2.98.0/gh_2.98.0_linux_amd64.tar.gz","sha256":"sha256:3b8ac6b30336802fc1a858d7c084e11cdf24ac1a761ca90b68022d7d729208de"},
      {"os":"linux","arch":"arm64","url":"https://github.com/cli/cli/releases/download/v2.98.0/gh_2.98.0_linux_arm64.tar.gz","sha256":"sha256:cf689084f3a3618f7eae4a2420d335d74626d65f5e594b9828d125d69f800d86"},
      {"os":"macos","arch":"amd64","url":"https://github.com/cli/cli/releases/download/v2.98.0/gh_2.98.0_macOS_amd64.zip","sha256":"sha256:734c7bbd0bc56a3974500ee9aea74d60f0e5b89be09e92b9d9148939a3a1e0e6"},
      {"os":"macos","arch":"arm64","url":"https://github.com/cli/cli/releases/download/v2.98.0/gh_2.98.0_macOS_arm64.zip","sha256":"sha256:8cfb027cc5310675f2b830eac8f9865c1155a45ffcf9757f699fdd5a22046ca4"}
    ],
    "certificate_identities": [
      {"kind":"production-acceptance-manifest","bundle_profile":"github-attestation","issuer_repository":"OpenAdaptAI/openadapt-evals","certificate_identity":"https://github.com/OpenAdaptAI/openadapt-evals/.github/workflows/issue-production-acceptance.yml@refs/heads/main"},
      {"kind":"production-acceptance-summary","bundle_profile":"github-attestation","issuer_repository":"OpenAdaptAI/openadapt-evals","certificate_identity":"https://github.com/OpenAdaptAI/openadapt-evals/.github/workflows/issue-production-acceptance.yml@refs/heads/main"},
      {"kind":"production-current-default","bundle_profile":"github-attestation","issuer_repository":"OpenAdaptAI/openadapt-ops","certificate_identity":"https://github.com/OpenAdaptAI/openadapt-ops/.github/workflows/production-current-default.yml@refs/heads/main"},
      {"kind":"production-lifecycle-checkpoint","bundle_profile":"github-attestation","issuer_repository":"OpenAdaptAI/openadapt-ops","certificate_identity":"https://github.com/OpenAdaptAI/openadapt-ops/.github/workflows/production-lifecycle-checkpoint.yml@refs/heads/main"},
      {"kind":"qualification-admission","bundle_profile":"github-attestation","issuer_repository":"OpenAdaptAI/.github","certificate_identity":"https://github.com/OpenAdaptAI/.github/.github/workflows/issue-qualification-admission.yml@refs/heads/main"},
      {"kind":"qualification-authority-state-receipt","bundle_profile":"github-attestation","issuer_repository":"OpenAdaptAI/openadapt-ops","certificate_identity":"https://github.com/OpenAdaptAI/openadapt-ops/.github/workflows/qualification-authority-state.yml@refs/heads/main"},
      {"kind":"qualification-evidence-decision-receipt","bundle_profile":"sigstore-message-signature","issuer_repository":"OpenAdaptAI/openadapt-internal","certificate_identity":"https://github.com/OpenAdaptAI/openadapt-internal/.github/workflows/issue-private-qualification-evidence-decision.yml@refs/heads/main"},
      {"kind":"qualification-release","bundle_profile":"github-attestation","issuer_repository":"OpenAdaptAI/.github","certificate_identity":"https://github.com/OpenAdaptAI/.github/.github/workflows/issue-production-release-admission.yml@refs/heads/main"},
      {"kind":"qualification-revocation-state-receipt","bundle_profile":"github-attestation","issuer_repository":"OpenAdaptAI/openadapt-ops","certificate_identity":"https://github.com/OpenAdaptAI/openadapt-ops/.github/workflows/qualification-revocation-state.yml@refs/heads/main"},
      {"kind":"support-release-admission","bundle_profile":"github-attestation","issuer_repository":"OpenAdaptAI/.github","certificate_identity":"https://github.com/OpenAdaptAI/.github/.github/workflows/issue-support-release-admission.yml@refs/heads/main"}
    ]
  }
}
